[{"id": "S.raft-B-0001", "c": "S.raft", "l": "B", "g": ["p", [[-30, -30], [4440, -30], [4440, 4440], [-30, 4440]], -4.7, -3.9, [[[-31, 2435], [767, 2435], [767, 1940], [3286, 1940], [3286, -31], [-31, -31]]]], "mark": "RAFT-80", "t": "raft80", "m": "conc", "a": {"thk_cm": 80}, "s": ["STR p11: \u00abSLAB -80cm THICK RAFT\u00bb"], "u": null}, {"id": "S.raft-B-0002", "c": "S.raft", "l": "B", "g": ["p", [[-31, 2435], [767, 2435], [767, 1940], [3286, 1940], [3286, -31], [-31, -31]], -5.4, -3.9], "mark": "PC1-150", "t": "raft150", "m": "conc", "a": {"thk_cm": 150}, "s": ["STR p11: \u00abPC1 - 150cm\u00bb"], "u": null}, {"id": "S.pile-B-0001", "c": "S.pile", "l": "B", "g": ["cyl", 345.6, 24.4, 30, -18.4, -5.4], "mark": "P1-01", "t": "pile", "m": "conc_sr", "a": {"dia_cm": 60, "len_m": 13}, "s": ["STR p11 layer PILES$0$ST-PILE (\u062f\u0627\u0626\u0631\u0629 \u00d860)", "STR p11: Pile length = 13m"], "u": null}, {"id": "S.pile-B-0002", "c": "S.pile", "l": "B", "g": ["cyl", 666.7, 24.4, 30, -18.4, -5.4], "mark": "P1-02", "t": "pile", "m": "conc_sr", "a": {"dia_cm": 60, "len_m": 13}, "s": ["STR p11 layer PILES$0$ST-PILE (\u062f\u0627\u0626\u0631\u0629 \u00d860)", "STR p11: Pile length = 13m"], "u": null}, {"id": "S.pile-B-0003", "c": "S.pile", "l": "B", "g": ["cyl", 987.8, 24.4, 30, -18.4, -5.4], "mark": "P1-03", "t": "pile", "m": "conc_sr", "a": {"dia_cm": 60, "len_m": 13}, "s": ["STR p11 layer PILES$0$ST-PILE (\u062f\u0627\u0626\u0631\u0629 \u00d860)", "STR p11: Pile length = 13m"], "u": null}, {"id": "S.pile-B-0004", "c": "S.pile", "l": "B", "g": ["cyl", 1309.0, 24.4, 30, -18.4, -5.4], "mark": "P1-04", "t": "pile", "m": "conc_sr", "a": {"dia_cm": 60, "len_m": 13}, "s": ["STR p11 layer PILES$0$ST-PILE (\u062f\u0627\u0626\u0631\u0629 \u00d860)", "STR p11: Pile length = 13m"], "u": null}, {"id": "S.pile-B-0005", "c": "S.pile", "l": "B", "g": ["cyl", 1630.1, 24.4, 30, -18.4, -5.4], "mark": "P1-05", "t": "pile", "m": "conc_sr", "a": {"dia_cm": 60, "len_m": 13}, "s": ["STR p11 layer PILES$0$ST-PILE (\u062f\u0627\u0626\u0631\u0629 \u00d860)", "STR p11: Pile length = 13m"], "u": null}, {"id": "S.pile-B-0006", "c": "S.pile", "l": "B", "g": ["cyl", 1951.2, 24.4, 30, -18.4, -5.4], "mark": "P1-06", "t": "pile", "m": "conc_sr", "a": {"dia_cm": 60, "len_m": 13}, "s": ["STR p11 layer PILES$0$ST-PILE (\u062f\u0627\u0626\u0631\u0629 \u00d860)", "STR p11: Pile length = 13m"], "u": null}, {"id": "S.pile-B-0007", "c": "S.pile", "l": "B", "g": ["cyl", 2272.3, 24.4, 30, -18.4, -5.4], "mark": "P1-07", "t": "pile", "m": "conc_sr", "a": {"dia_cm": 60, "len_m": 13}, "s": ["STR p11 layer PILES$0$ST-PILE (\u062f\u0627\u0626\u0631\u0629 \u00d860)", "STR p11: Pile length = 13m"], "u": null}, {"id": "S.pile-B-0008", "c": "S.pile", "l": "B", "g": ["cyl", 2593.4, 24.4, 30, -18.4, -5.4], "mark": "P1-08", "t": "pile", "m": "conc_sr", "a": {"dia_cm": 60, "len_m": 13}, "s": ["STR p11 layer PILES$0$ST-PILE (\u062f\u0627\u0626\u0631\u0629 \u00d860)", "STR p11: Pile length = 13m"], "u": null}, {"id": "S.pile-B-0009", "c": "S.pile", "l": "B", "g": ["cyl", 2914.6, 24.4, 30, -18.4, -5.4], "mark": "P1-09", "t": "pile", "m": "conc_sr", "a": {"dia_cm": 60, "len_m": 13}, "s": ["STR p11 layer PILES$0$ST-PILE (\u062f\u0627\u0626\u0631\u0629 \u00d860)", "STR p11: Pile length = 13m"], "u": null}, {"id": "S.pile-B-0010", "c": "S.pile", "l": "B", "g": ["cyl", 3235.7, 24.4, 30, -18.4, -5.4], "mark": "P1-10", "t": "pile", "m": "conc_sr", "a": {"dia_cm": 60, "len_m": 13}, "s": ["STR p11 layer PILES$0$ST-PILE (\u062f\u0627\u0626\u0631\u0629 \u00d860)", "STR p11: Pile length = 13m"], "u": null}, {"id": "S.pile-B-0011", "c": "S.pile", "l": "B", "g": ["cyl", 24.5, 29.2, 30, -18.4, -5.4], "mark": "P1-11", "t": "pile", "m": "conc_sr", "a": {"dia_cm": 60, "len_m": 13}, "s": ["STR p11 layer PILES$0$ST-PILE (\u062f\u0627\u0626\u0631\u0629 \u00d860)", "STR p11: Pile length = 13m"], "u": null}, {"id": "S.pile-B-0012", "c": "S.pile", "l": "B", "g": ["cyl", 24.5, 323.8, 30, -18.4, -5.4], "mark": "P1-12", "t": "pile", "m": "conc_sr", "a": {"dia_cm": 60, "len_m": 13}, "s": ["STR p11 layer PILES$0$ST-PILE (\u062f\u0627\u0626\u0631\u0629 \u00d860)", "STR p11: Pile length = 13m"], "u": null}, {"id": "S.pile-B-0013", "c": "S.pile", "l": "B", "g": ["cyl", 345.6, 318.7, 30, -18.4, -5.4], "mark": "P1-13", "t": "pile", "m": "conc_sr", "a": {"dia_cm": 60, "len_m": 13}, "s": ["STR p11 layer PILES$0$ST-PILE (\u062f\u0627\u0626\u0631\u0629 \u00d860)", "STR p11: Pile length = 13m"], "u": null}, {"id": "S.pile-B-0014", "c": "S.pile", "l": "B", "g": ["cyl", 666.7, 318.7, 30, -18.4, -5.4], "mark": "P1-14", "t": "pile", "m": "conc_sr", "a": {"dia_cm": 60, "len_m": 13}, "s": ["STR p11 layer PILES$0$ST-PILE (\u062f\u0627\u0626\u0631\u0629 \u00d860)", "STR p11: Pile length = 13m"], "u": null}, {"id": "S.pile-B-0015", "c": "S.pile", "l": "B", "g": ["cyl", 987.8, 318.7, 30, -18.4, -5.4], "mark": "P1-15", "t": "pile", "m": "conc_sr", "a": {"dia_cm": 60, "len_m": 13}, "s": ["STR p11 layer PILES$0$ST-PILE (\u062f\u0627\u0626\u0631\u0629 \u00d860)", "STR p11: Pile length = 13m"], "u": null}, {"id": "S.pile-B-0016", "c": "S.pile", "l": "B", "g": ["cyl", 1309.0, 318.7, 30, -18.4, -5.4], "mark": "P1-16", "t": "pile", "m": "conc_sr", "a": {"dia_cm": 60, "len_m": 13}, "s": ["STR p11 layer PILES$0$ST-PILE (\u062f\u0627\u0626\u0631\u0629 \u00d860)", "STR p11: Pile length = 13m"], "u": null}, {"id": "S.pile-B-0017", "c": "S.pile", "l": "B", "g": ["cyl", 1630.1, 318.7, 30, -18.4, -5.4], "mark": "P1-17", "t": "pile", "m": "conc_sr", "a": {"dia_cm": 60, "len_m": 13}, "s": ["STR p11 layer PILES$0$ST-PILE (\u062f\u0627\u0626\u0631\u0629 \u00d860)", "STR p11: Pile length = 13m"], "u": null}, {"id": "S.pile-B-0018", "c": "S.pile", "l": "B", "g": ["cyl", 1951.2, 318.7, 30, -18.4, -5.4], "mark": "P1-18", "t": "pile", "m": "conc_sr", "a": {"dia_cm": 60, "len_m": 13}, "s": ["STR p11 layer PILES$0$ST-PILE (\u062f\u0627\u0626\u0631\u0629 \u00d860)", "STR p11: Pile length = 13m"], "u": null}, {"id": "S.pile-B-0019", "c": "S.pile", "l": "B", "g": ["cyl", 2272.3, 318.7, 30, -18.4, -5.4], "mark": "P1-19", "t": "pile", "m": "conc_sr", "a": {"dia_cm": 60, "len_m": 13}, "s": ["STR p11 layer PILES$0$ST-PILE (\u062f\u0627\u0626\u0631\u0629 \u00d860)", "STR p11: Pile length = 13m"], "u": null}, {"id": "S.pile-B-0020", "c": "S.pile", "l": "B", "g": ["cyl", 2593.4, 318.7, 30, -18.4, -5.4], "mark": "P1-20", "t": "pile", "m": "conc_sr", "a": {"dia_cm": 60, "len_m": 13}, "s": ["STR p11 layer PILES$0$ST-PILE (\u062f\u0627\u0626\u0631\u0629 \u00d860)", "STR p11: Pile length = 13m"], "u": null}, {"id": "S.pile-B-0021", "c": "S.pile", "l": "B", "g": ["cyl", 2914.6, 318.7, 30, -18.4, -5.4], "mark": "P1-21", "t": "pile", "m": "conc_sr", "a": {"dia_cm": 60, "len_m": 13}, "s": ["STR p11 layer PILES$0$ST-PILE (\u062f\u0627\u0626\u0631\u0629 \u00d860)", "STR p11: Pile length = 13m"], "u": null}, {"id": "S.pile-B-0022", "c": "S.pile", "l": "B", "g": ["cyl", 3235.7, 318.7, 30, -18.4, -5.4], "mark": "P1-22", "t": "pile", "m": "conc_sr", "a": {"dia_cm": 60, "len_m": 13}, "s": ["STR p11 layer PILES$0$ST-PILE (\u062f\u0627\u0626\u0631\u0629 \u00d860)", "STR p11: Pile length = 13m"], "u": null}, {"id": "S.pile-B-0023", "c": "S.pile", "l": "B", "g": ["cyl", 24.5, 618.1, 30, -18.4, -5.4], "mark": "P1-23", "t": "pile", "m": "conc_sr", "a": {"dia_cm": 60, "len_m": 13}, "s": ["STR p11 layer PILES$0$ST-PILE (\u062f\u0627\u0626\u0631\u0629 \u00d860)", "STR p11: Pile length = 13m"], "u": null}, {"id": "S.pile-B-0024", "c": "S.pile", "l": "B", "g": ["cyl", 345.6, 613.1, 30, -18.4, -5.4], "mark": "P1-24", "t": "pile", "m": "conc_sr", "a": {"dia_cm": 60, "len_m": 13}, "s": ["STR p11 layer PILES$0$ST-PILE (\u062f\u0627\u0626\u0631\u0629 \u00d860)", "STR p11: Pile length = 13m"], "u": null}, {"id": "S.pile-B-0025", "c": "S.pile", "l": "B", "g": ["cyl", 666.7, 613.1, 30, -18.4, -5.4], "mark": "P1-25", "t": "pile", "m": "conc_sr", "a": {"dia_cm": 60, "len_m": 13}, "s": ["STR p11 layer PILES$0$ST-PILE (\u062f\u0627\u0626\u0631\u0629 \u00d860)", "STR p11: Pile length = 13m"], "u": null}, {"id": "S.pile-B-0026", "c": "S.pile", "l": "B", "g": ["cyl", 987.8, 613.1, 30, -18.4, -5.4], "mark": "P1-26", "t": "pile", "m": "conc_sr", "a": {"dia_cm": 60, "len_m": 13}, "s": ["STR p11 layer PILES$0$ST-PILE (\u062f\u0627\u0626\u0631\u0629 \u00d860)", "STR p11: Pile length = 13m"], "u": null}, {"id": "S.pile-B-0027", "c": "S.pile", "l": "B", "g": ["cyl", 1309.0, 613.1, 30, -18.4, -5.4], "mark": "P1-27", "t": "pile", "m": "conc_sr", "a": {"dia_cm": 60, "len_m": 13}, "s": ["STR p11 layer PILES$0$ST-PILE (\u062f\u0627\u0626\u0631\u0629 \u00d860)", "STR p11: Pile length = 13m"], "u": null}, {"id": "S.pile-B-0028", "c": "S.pile", "l": "B", "g": ["cyl", 1630.1, 613.1, 30, -18.4, -5.4], "mark": "P1-28", "t": "pile", "m": "conc_sr", "a": {"dia_cm": 60, "len_m": 13}, "s": ["STR p11 layer PILES$0$ST-PILE (\u062f\u0627\u0626\u0631\u0629 \u00d860)", "STR p11: Pile length = 13m"], "u": null}, {"id": "S.pile-B-0029", "c": "S.pile", "l": "B", "g": ["cyl", 1951.2, 613.1, 30, -18.4, -5.4], "mark": "P1-29", "t": "pile", "m": "conc_sr", "a": {"dia_cm": 60, "len_m": 13}, "s": ["STR p11 layer PILES$0$ST-PILE (\u062f\u0627\u0626\u0631\u0629 \u00d860)", "STR p11: Pile length = 13m"], "u": null}, {"id": "S.pile-B-0030", "c": "S.pile", "l": "B", "g": ["cyl", 2272.3, 613.1, 30, -18.4, -5.4], "mark": "P1-30", "t": "pile", "m": "conc_sr", "a": {"dia_cm": 60, "len_m": 13}, "s": ["STR p11 layer PILES$0$ST-PILE (\u062f\u0627\u0626\u0631\u0629 \u00d860)", "STR p11: Pile length = 13m"], "u": null}, {"id": "S.pile-B-0031", "c": "S.pile", "l": "B", "g": ["cyl", 2593.4, 613.1, 30, -18.4, -5.4], "mark": "P1-31", "t": "pile", "m": "conc_sr", "a": {"dia_cm": 60, "len_m": 13}, "s": ["STR p11 layer PILES$0$ST-PILE (\u062f\u0627\u0626\u0631\u0629 \u00d860)", "STR p11: Pile length = 13m"], "u": null}, {"id": "S.pile-B-0032", "c": "S.pile", "l": "B", "g": ["cyl", 2914.6, 613.1, 30, -18.4, -5.4], "mark": "P1-32", "t": "pile", "m": "conc_